{
  "$schema": "../../../../schemas/records/bom-products.schema.json",
  "schema_version": "1.0.0",
  "id": "bom.products.device.network_hub",
  "record_type": "bom-products",
  "data": {
    "catalog_ref": "device.network_hub",
    "production_status": "design_baseline",
    "assembly_refs": [
      "assembly.device.network_hub.4_port",
      "assembly.device.network_hub.8_port",
      "assembly.device.network_hub.16_port"
    ],
    "requirements": [
      "Qualify 4-, 8- and 16-port SKUs with a shared selectable clock, negotiation/recovery firmware and receiver-credit-aware arbiter. Forward by streaming at one common rate; no per-port rate conversion. Separate per-port connector/transceiver/protection costs from shared logic/PSU. Qualify cables, fault isolation and diagnostics at 100/250/500/1000 kbit/s. Port count does not multiply the maximum 1 Mbit/s shared raw capacity.",
      "Manufacturer/MPN or released make drawing, approved alternatives and historical supply qualification",
      "PCB dimensions, layer stack, finish, connectors, fitted passives and reference designators",
      "Power per rail, startup/thermal limits and region-specific power configuration",
      "Firmware image capacity/revision, programming and verification",
      "Assembly routing, test fixtures, cycle times, yield/rework/scrap and packout"
    ]
  }
}
