{
  "$schema": "../../../../schemas/records/bom-products.schema.json",
  "schema_version": "1.0.0",
  "id": "bom.products.part.artemis_ram_module_prototype",
  "record_type": "bom-products",
  "data": {
    "catalog_ref": "part.artemis_ram_module_prototype",
    "production_status": "excluded",
    "assembly_refs": [],
    "requirements": [
      "Retain noncommercial engineering status. Its chip count implies 32 KiB",
      "define width/PCB/connectors separately from a new production M32-16.",
      "Manufacturer/MPN or released make drawing, approved alternatives and historical supply qualification",
      "PCB dimensions, layer stack, finish, connectors, fitted passives and reference designators",
      "Power per rail, startup/thermal limits and region-specific power configuration",
      "Firmware image capacity/revision, programming and verification",
      "Assembly routing, test fixtures, cycle times, yield/rework/scrap and packout"
    ]
  }
}
