{
  "$schema": "../../../../schemas/records/bom-products.schema.json",
  "schema_version": "1.0.0",
  "id": "bom.products.computer.aurelia_plus",
  "record_type": "bom-products",
  "data": {
    "catalog_ref": "computer.aurelia_plus",
    "production_status": "design_baseline",
    "assembly_refs": [
      "assembly.computer.aurelia_plus.base"
    ],
    "requirements": [
      "Qualify eight AION-manufactured 64K×1 DRAMs (64 KiB total, one 8-bit bank) before December 1979. Confirm package/pinout, supply rails, retention, refresh deadlines and 6 MHz host timing.",
      "Populate one shared Aurelia video controller and eight AION-manufactured 4116-equivalent 16Kx1 DRAMs (16 KiB). Qualify CPU arbitration at the host clock, refresh, pixel FIFO deadlines, package, rails and external video/control line drivers.",
      "Qualify dual-drive controller/mechanisms, ROM images/capacities, 6 MHz host timing and PSU/thermal deltas.",
      "Provide three independent point-to-point FlexiBUS host ports, including connectors, transceivers, protection and power budget; qualify simultaneous keyboard, disk and printer service. Controller die count depends on ports per die.",
      "Manufacturer/MPN or released make drawing, approved alternatives and historical supply qualification",
      "PCB dimensions, layer stack, finish, connectors, fitted passives and reference designators",
      "Power per rail, startup/thermal limits and region-specific power configuration",
      "Firmware image capacity/revision, programming and verification",
      "Assembly routing, test fixtures, cycle times, yield/rework/scrap and packout",
      "Qualify AION 1Kx4 static cells, 250 ns cycle target, retention while powered, +5 V supply and 18-pin DIP compatibility before launch.",
      "Test two-chip 1Kx8 sprite bus, CPU/DMA write arbitration and worst-case five-sprite overlap.",
      "Qualify CPU bus handover at 4 and 6 MHz, bounded DMA bursts, device-ready waits, completion interrupts and abort/reset recovery.",
      "Verify independent refresh for every installed physical bank, including hidden banks and Aurelia 16 KiB expansion; derive deadlines from qualified DRAM ordering codes.",
      "Freeze package/pinout, external buffers, memory decode, bank-latched DMA addressing and simultaneous video/peripheral stress tests."
    ]
  }
}
