{
  "$schema": "../../../../schemas/records/bom-products.schema.json",
  "schema_version": "1.0.0",
  "id": "bom.products.part.athena_ram_module_256kb",
  "record_type": "bom-products",
  "data": {
    "catalog_ref": "part.athena_ram_module_256kb",
    "production_status": "excluded",
    "assembly_refs": [],
    "requirements": [
      "Planned Athena/ERA² product; excluded from current costed production coverage, not cancelled. Functional quantities are recorded in athena_1983_program.json.",
      "Release component selections, electrical design, manufacturing routing and a dated 1983 cost assessment before including in financial forecasts."
    ]
  }
}
