{
  "$schema": "../../../../schemas/records/bom-products.schema.json",
  "schema_version": "1.0.0",
  "id": "bom.products.part.color_monitor_controller",
  "record_type": "bom-products",
  "data": {
    "catalog_ref": "part.color_monitor_controller",
    "production_status": "design_baseline",
    "assembly_refs": [
      "assembly.part.color_monitor_controller"
    ],
    "requirements": [
      "Locate the 16×12-bit palette storage, command decoder, clocking, RGB conversion and external analog drivers",
      "establish whether Monitor I/II share silicon but differ in bandwidth/output stages.",
      "Manufacturer/MPN or released make drawing, approved alternatives and historical supply qualification",
      "PCB dimensions, layer stack, finish, connectors, fitted passives and reference designators",
      "Power per rail, startup/thermal limits and region-specific power configuration",
      "Firmware image capacity/revision, programming and verification",
      "Assembly routing, test fixtures, cycle times, yield/rework/scrap and packout"
    ]
  }
}
