{
  "$schema": "../../../../schemas/records/bom-products.schema.json",
  "schema_version": "1.0.0",
  "id": "bom.products.part.mono_pro_17_controller",
  "record_type": "bom-products",
  "data": {
    "catalog_ref": "part.mono_pro_17_controller",
    "production_status": "design_baseline",
    "assembly_refs": [
      "assembly.part.mono_pro_17_controller"
    ],
    "requirements": [
      "Engineering planning BOM; quoted costs, electrical qualification and measured routing remain pending."
    ]
  }
}
