{
  "$schema": "../../../../schemas/records/bom-products.schema.json",
  "schema_version": "1.0.0",
  "id": "bom.products.device.logix_mouse",
  "record_type": "bom-products",
  "data": {
    "catalog_ref": "device.logix_mouse",
    "production_status": "design_baseline",
    "assembly_refs": [
      "assembly.device.logix_mouse"
    ],
    "requirements": [
      "Engineering planning BOM; quoted costs, electrical qualification and measured routing remain pending."
    ]
  }
}
