{
  "$schema": "../../../../schemas/records/bom-products.schema.json",
  "schema_version": "1.0.0",
  "id": "bom.products.device.artemis_video_card",
  "record_type": "bom-products",
  "data": {
    "catalog_ref": "device.artemis_video_card",
    "production_status": "design_baseline",
    "assembly_refs": [
      "assembly.device.artemis_video_card"
    ],
    "requirements": [
      "Qualification pending."
    ]
  }
}
