{
  "$schema": "../../../../schemas/records/bom-products.schema.json",
  "schema_version": "1.0.0",
  "id": "bom.products.device.artemis_ram_64kb_bank_kit",
  "record_type": "bom-products",
  "data": {
    "catalog_ref": "device.artemis_ram_64kb_bank_kit",
    "production_status": "design_baseline",
    "assembly_refs": [
      "assembly.device.artemis_ram_64kb_bank_kit"
    ],
    "requirements": [
      "New production RAM assembly: freeze connector, PCB, power rails, qualified speed, identification and electrical tests.",
      "Manufacturer/MPN or released make drawing, approved alternatives and historical supply qualification",
      "PCB dimensions, layer stack, finish, connectors, fitted passives and reference designators",
      "Power per rail, startup/thermal limits and region-specific power configuration",
      "Firmware image capacity/revision, programming and verification",
      "Assembly routing, test fixtures, cycle times, yield/rework/scrap and packout"
    ]
  }
}
