{
  "$schema": "../../../../schemas/records/bom-products.schema.json",
  "schema_version": "1.0.0",
  "id": "bom.products.part.dram_64kbit",
  "record_type": "bom-products",
  "data": {
    "catalog_ref": "part.dram_64kbit",
    "production_status": "design_baseline",
    "assembly_refs": [
      "assembly.part.dram_64kbit"
    ],
    "requirements": [
      "Add 64K×1 and sourcing by launch date",
      "rails/refresh/timing/package. Link to Aurelia+, high-density modules and any selected compatibility-card local RAM.",
      "Manufacturer/MPN or released make drawing, approved alternatives and historical supply qualification",
      "PCB dimensions, layer stack, finish, connectors, fitted passives and reference designators",
      "Power per rail, startup/thermal limits and region-specific power configuration",
      "Firmware image capacity/revision, programming and verification",
      "Assembly routing, test fixtures, cycle times, yield/rework/scrap and packout"
    ]
  }
}
