{
  "$schema": "../../../../schemas/records/bom-products.schema.json",
  "schema_version": "1.0.0",
  "id": "bom.products.device.apple2_expansion_card",
  "record_type": "bom-products",
  "data": {
    "catalog_ref": "device.apple2_expansion_card",
    "production_status": "design_baseline",
    "assembly_refs": [
      "assembly.device.apple2_expansion_card"
    ],
    "requirements": [
      "Apple bus decode/buffering and connector, identification/boot/driver ROM size, port-controller count, transceivers and any FIFO, Disk II sequencing/data handling, timing and firmware ownership. Freeze how native Disk II and FlexiBUS drive access coexist. Existing retail price is not component cost.",
      "Manufacturer/MPN or released make drawing, approved alternatives and historical supply qualification",
      "PCB dimensions, layer stack, finish, connectors, fitted passives and reference designators",
      "Power per rail, startup/thermal limits and region-specific power configuration",
      "Firmware image capacity/revision, programming and verification",
      "Assembly routing, test fixtures, cycle times, yield/rework/scrap and packout"
    ]
  }
}
