{
  "$schema": "../../../../schemas/records/bom-products.schema.json",
  "schema_version": "1.0.0",
  "id": "bom.products.part.artemis_ram_module_128kb_aion",
  "record_type": "bom-products",
  "data": {
    "catalog_ref": "part.artemis_ram_module_128kb_aion",
    "production_status": "design_baseline",
    "assembly_refs": [
      "assembly.part.artemis_ram_module_128kb_aion"
    ],
    "requirements": [
      "Accepted planning design; qualification pending."
    ]
  }
}
