{
  "$schema": "../../../../schemas/records/bom-products.schema.json",
  "schema_version": "1.0.0",
  "id": "bom.products.part.flexibus_host_controller",
  "record_type": "bom-products",
  "data": {
    "catalog_ref": "part.flexibus_host_controller",
    "production_status": "design_baseline",
    "assembly_refs": [
      "assembly.part.flexibus_host_controller"
    ],
    "requirements": [
      "Specify ports per die, host bus interface, FIFO/register capacity, clock, firmware/ROM requirements, external transceivers and packages",
      "update PRO/Apple-card usage where appropriate. All custom-silicon costing fields also required.",
      "Manufacturer/MPN or released make drawing, approved alternatives and historical supply qualification",
      "PCB dimensions, layer stack, finish, connectors, fitted passives and reference designators",
      "Power per rail, startup/thermal limits and region-specific power configuration",
      "Firmware image capacity/revision, programming and verification",
      "Assembly routing, test fixtures, cycle times, yield/rework/scrap and packout"
    ]
  }
}
