{
  "$schema": "../../../../schemas/records/bom-products.schema.json",
  "schema_version": "1.0.0",
  "id": "bom.products.part.aurelia_monitor_dac",
  "record_type": "bom-products",
  "data": {
    "catalog_ref": "part.aurelia_monitor_dac",
    "production_status": "design_baseline",
    "assembly_refs": [
      "assembly.part.aurelia_monitor_dac"
    ],
    "requirements": [
      "Specify reference, transfer function/linearity, output range, settling time, package and required analog stages. Decide custom silicon versus a discrete implementation before assigning die cost.",
      "Manufacturer/MPN or released make drawing, approved alternatives and historical supply qualification",
      "PCB dimensions, layer stack, finish, connectors, fitted passives and reference designators",
      "Power per rail, startup/thermal limits and region-specific power configuration",
      "Firmware image capacity/revision, programming and verification",
      "Assembly routing, test fixtures, cycle times, yield/rework/scrap and packout"
    ]
  }
}
