{
  "$schema": "../../../../schemas/records/bom-products.schema.json",
  "schema_version": "1.0.0",
  "id": "bom.products.part.artemis_ram_module_64kb",
  "record_type": "bom-products",
  "data": {
    "catalog_ref": "part.artemis_ram_module_64kb",
    "production_status": "excluded",
    "assembly_refs": [],
    "requirements": [
      "Existing eight-chip board is ×8. Supersede in the paired ×16 architecture",
      "identify how existing prototypes/spares are handled.",
      "Manufacturer/MPN or released make drawing, approved alternatives and historical supply qualification",
      "PCB dimensions, layer stack, finish, connectors, fitted passives and reference designators",
      "Power per rail, startup/thermal limits and region-specific power configuration",
      "Firmware image capacity/revision, programming and verification",
      "Assembly routing, test fixtures, cycle times, yield/rework/scrap and packout"
    ]
  }
}
